{
  "schemaVersion": "msp.publication-record.v1",
  "status": "completed",
  "releaseVersion": "0.2.0-alpha.1",
  "tag": "v0.2.0-alpha.1",
  "releaseCommit": "aaaaaaaaaaaaaaaaaaaaaaaaaaaaaaaaaaaaaaaa",
  "releaseRecord": "docs/ops/release-records/0.2.0-alpha.1.approved.release.json",
  "registryTarget": "npmjs.org",
  "observedDistTags": {
    "latest": "0.2.0-alpha.1",
    "bootstrap": "0.0.0-bootstrap.0"
  },
  "publishedAt": "2026-07-15T09:40:02Z",
  "recordedAt": "2026-07-15T09:44:51Z",
  "releaseRun": {
    "workflow": "release.yml",
    "id": 101,
    "headCommit": "aaaaaaaaaaaaaaaaaaaaaaaaaaaaaaaaaaaaaaaa",
    "conclusion": "success",
    "url": "https://github.com/0disoft/mcp-security-proxy/actions/runs/101"
  },
  "registrySmokeRun": {
    "workflow": "registry-smoke.yml",
    "id": 102,
    "headCommit": "aaaaaaaaaaaaaaaaaaaaaaaaaaaaaaaaaaaaaaaa",
    "conclusion": "success",
    "url": "https://github.com/0disoft/mcp-security-proxy/actions/runs/102"
  },
  "packages": [
    {
      "name": "@0disoft/mcp-security-proxy-contracts",
      "version": "0.2.0-alpha.1",
      "integrity": "sha512-Zml4dHVyZQ==",
      "shasum": "bbbbbbbbbbbbbbbbbbbbbbbbbbbbbbbbbbbbbbbb",
      "provenance": {
        "predicateType": "https://slsa.dev/provenance/v1",
        "verifiedByRunId": 102
      }
    },
    {
      "name": "@0disoft/mcp-security-proxy-core",
      "version": "0.2.0-alpha.1",
      "integrity": "sha512-Zml4dHVyZQ==",
      "shasum": "bbbbbbbbbbbbbbbbbbbbbbbbbbbbbbbbbbbbbbbb",
      "provenance": {
        "predicateType": "https://slsa.dev/provenance/v1",
        "verifiedByRunId": 102
      }
    },
    {
      "name": "@0disoft/mcp-security-proxy-mcp-adapter",
      "version": "0.2.0-alpha.1",
      "integrity": "sha512-Zml4dHVyZQ==",
      "shasum": "bbbbbbbbbbbbbbbbbbbbbbbbbbbbbbbbbbbbbbbb",
      "provenance": {
        "predicateType": "https://slsa.dev/provenance/v1",
        "verifiedByRunId": 102
      }
    },
    {
      "name": "@0disoft/mcp-security-proxy-runtime",
      "version": "0.2.0-alpha.1",
      "integrity": "sha512-Zml4dHVyZQ==",
      "shasum": "bbbbbbbbbbbbbbbbbbbbbbbbbbbbbbbbbbbbbbbb",
      "provenance": {
        "predicateType": "https://slsa.dev/provenance/v1",
        "verifiedByRunId": 102
      }
    },
    {
      "name": "@0disoft/mcp-security-proxy-cli",
      "version": "0.2.0-alpha.1",
      "integrity": "sha512-Zml4dHVyZQ==",
      "shasum": "bbbbbbbbbbbbbbbbbbbbbbbbbbbbbbbbbbbbbbbb",
      "provenance": {
        "predicateType": "https://slsa.dev/provenance/v1",
        "verifiedByRunId": 102
      }
    }
  ]
}
